{
  "profile_schema_version": "1.0.0",
  "protocol_id": "p5-high-order-privacy",
  "protocol_version": "1.0.0",
  "display_name": "P5 High-order Fidelity and Empirical Privacy diagnostics",
  "status": "draft",
  "official_results_allowed": false,
  "comparison_tracks": ["native", "standardized-tuning"],
  "metric_selections": [
    {"metric_id":"std-c2st-rf-auroc","metric_version":"1.0.0","required":true,"role":"diagnostic"},
    {"metric_id":"std-c2st-fidelity","metric_version":"1.0.0","required":true,"role":"diagnostic"},
    {"metric_id":"std-exact-train-collision-rate","metric_version":"1.0.0","required":true,"role":"diagnostic"},
    {"metric_id":"std-synthetic-internal-duplicate-rate","metric_version":"1.0.0","required":true,"role":"diagnostic"},
    {"metric_id":"sdmetrics-dcr-distribution","metric_version":"1.0.0","required":true,"role":"diagnostic"},
    {"metric_id":"std-dcr-heldout-wasserstein","metric_version":"1.0.0","required":true,"role":"diagnostic"},
    {"metric_id":"domias-kde-attack-auroc","metric_version":"1.0.0","required":true,"role":"diagnostic"},
    {"metric_id":"domias-kde-attack-accuracy","metric_version":"1.0.0","required":true,"role":"diagnostic"},
    {"metric_id":"domias-kde-attack-advantage","metric_version":"1.0.0","required":true,"role":"diagnostic"},
    {"metric_id":"domias-kde-tpr-at-fpr-01","metric_version":"1.0.0","required":true,"role":"diagnostic"}
  ],
  "dataset_suites": ["diagnostic"],
  "result_schema_versions": {"atomic_result":"1.0.0","manifest":"1.0.0","metadata":"1.0.0","summary":"1.0.0","stage_record":"1.0.0","artifact_index":"1.0.0"},
  "policies": {
    "table_boundary": "Checksum-bound real train, disjoint held-out real test, and immutable synthetic model view; no repair.",
    "c2st": "Balanced heldout-real versus synthetic Random-Forest C2ST with train-fitted transform, five seeds, raw AUROC, and a separate label-invariant AUROC fidelity complement.",
    "exact_rows": "Training collisions and internal synthetic duplicates are separate full-table rates.",
    "dcr": "Exact pinned SDMetrics DCR arrays for synthetic-to-train and heldout-to-train, compared by Wasserstein distance; raw DCR is distributional.",
    "domias": "Black-box DOMIAS KDE density-ratio attack with disjoint members, nonmembers, and auxiliary reference; mixed-table representation is an explicit benchmark adaptation.",
    "privacy_claim": "Empirical attacks and distance diagnostics do not establish a formal privacy guarantee.",
    "overall_score": "prohibited",
    "excluded": "Authenticity, Delta Presence, Alpha/Beta support metrics, attribute inference, and GReaT accuracy do not contribute."
  },
  "owners": ["repository-maintainers"],
  "review_record": {"status":"confirmatory-freeze-candidate","official_admission":"Scientific identity is preregistered; approval depends only on declared completeness, structural, provenance, and reproducibility gates."},
  "change_log": [
    {"version":"0.1.0","change":"Implemented the first end-to-end P5 high-order fidelity and empirical privacy diagnostic protocol."},
    {"version":"1.0.0","change":"Preregistered the unchanged ten-metric scientific identity for an independent TabDDPM/Adult three-seed confirmatory run."}
  ]
}
